{
  "schemaVersion": "1.0.0",
  "id": "graph-fundamentals",
  "version": "1.0.0",
  "title": "Graph Fundamentals: From Traversal to Minimum Spanning Trees",
  "shortTitle": "Graphs, DSU & MST",
  "description": "An interview-focused journey from graph vocabulary and traversal through disjoint sets, Kruskal, and Prim—using one weighted network all the way through.",
  "category": "Data Structures & Algorithms",
  "accent": "#7C6CF2",
  "estimatedMinutes": 37,
  "audience": "Coding-interview candidates who know arrays, functions, and basic Big-O notation",
  "prerequisites": [
    "Comfort reading short pseudocode",
    "Basic arrays, loops, queues, stacks, and recursion",
    "Basic time and space complexity"
  ],
  "learningOutcomes": [
    "Model a problem as a graph and select an appropriate representation",
    "Use BFS, DFS, and connected components with clear complexity reasoning",
    "Implement Disjoint Set Union with union by size and path compression",
    "Recognize when DSU fits a connectivity problem and when it does not",
    "Derive and implement Kruskal's and Prim's minimum spanning tree algorithms",
    "Handle common MST edge cases and transfer the patterns to interview problems"
  ],
  "sources": [
    {
      "id": "princeton-graphs",
      "title": "Algorithms, 4th Edition — Section 4.1: Undirected Graphs",
      "url": "https://algs4.cs.princeton.edu/41graph/"
    },
    {
      "id": "princeton-uf",
      "title": "Algorithms, 4th Edition — Section 1.5: Case Study: Union-Find",
      "url": "https://algs4.cs.princeton.edu/15uf/"
    },
    {
      "id": "mit-disjoint-sets",
      "title": "MIT OpenCourseWare 6.046J — Lecture 16: Disjoint-set Data Structures",
      "url": "https://ocw.mit.edu/courses/6-046j-design-and-analysis-of-algorithms-spring-2012/resources/mit6_046js12_lec16/"
    },
    {
      "id": "princeton-mst",
      "title": "Algorithms, 4th Edition — Section 4.3: Minimum Spanning Trees",
      "url": "https://algs4.cs.princeton.edu/43mst/"
    },
    {
      "id": "mit-mst",
      "title": "MIT OpenCourseWare 6.046J — Lecture 3: Minimum Spanning Trees I",
      "url": "https://ocw.mit.edu/courses/6-046j-design-and-analysis-of-algorithms-spring-2012/resources/mit6_046js12_lec03/"
    },
    {
      "id": "mit-mst-ii",
      "title": "MIT OpenCourseWare 6.046J — Lecture 4: Minimum Spanning Trees II",
      "url": "https://ocw.mit.edu/courses/6-046j-design-and-analysis-of-algorithms-spring-2012/resources/mit6_046js12_lec04/"
    }
  ],
  "milestones": [
    {
      "id": "graph-language",
      "title": "Read the Map",
      "shortTitle": "Graph Basics",
      "description": "Build the vocabulary, representations, and traversal instincts needed for every later step."
    },
    {
      "id": "disjoint-sets",
      "title": "Track Changing Connections",
      "shortTitle": "DSU",
      "description": "Turn incremental connectivity into fast set operations with a parent forest."
    },
    {
      "id": "minimum-spanning-trees",
      "title": "Connect Everything for Less",
      "shortTitle": "MST",
      "description": "Use safe greedy choices to build and reason about minimum spanning trees."
    }
  ],
  "blocks": [
    {
      "id": "graph-as-relationships",
      "milestoneId": "graph-language",
      "order": 1,
      "kind": "concept",
      "eyebrow": "Graph Basics · 1 of 8",
      "title": "A graph stores relationships",
      "learningObjective": "Identify vertices and edges and read the stable HarborNet example.",
      "coreFacts": [
        "A graph G = (V, E) consists of vertices V and edges E.",
        "An edge records a relationship between two vertices.",
        "HarborNet uses vertices A–F and nine weighted undirected edges throughout this topic."
      ],
      "estimatedSeconds": 65,
      "presentations": {
        "standard": {
          "hook": "Graphs start with a small shift: store relationships, not rows.",
          "body": [
            "A graph G = (V, E) has vertices—also called nodes—and edges that connect them. A vertex might be a city, user, task, or web page; an edge might be a road, friendship, dependency, or link.",
            "Our running example is HarborNet: six islands A–F joined by possible cable routes. The number on an edge is its construction cost. The same network will make traversal, DSU, and MST feel like one connected idea."
          ]
        },
        "story": {
          "hook": "Six islands need a communication network.",
          "body": [
            "The Harbor Master pins islands A–F on a wall and draws every possible cable route. Islands map to vertices; routes map to edges; route costs map to edge weights.",
            "Analogy limit: a drawn route is abstract—it need not be physical. In another graph, an edge could mean friendship or a software dependency."
          ]
        },
        "challenge": {
          "prompt": "In a social-network graph, what should users and friendships become?",
          "hint": "Ask which objects exist, then which relationship connects pairs of objects.",
          "answer": "Users are vertices and friendships are edges. If friendship is mutual, those edges are undirected.",
          "body": [
            "Interview translation starts by naming V and E. Only after the model is clear should you choose traversal or storage details."
          ]
        }
      },
      "visual": {
        "type": "graph",
        "title": "HarborNet",
        "caption": "Six vertices and nine possible weighted links.",
        "alt": "An undirected weighted graph with vertices A through F and edges AB 4, AC 2, BC 1, BD 5, CD 8, CE 10, DE 2, DF 6, and EF 3.",
        "data": {
          "nodes": [
            { "id": "A", "label": "A", "x": 8, "y": 28 },
            { "id": "B", "label": "B", "x": 34, "y": 12 },
            { "id": "C", "label": "C", "x": 31, "y": 60 },
            { "id": "D", "label": "D", "x": 62, "y": 42 },
            { "id": "E", "label": "E", "x": 82, "y": 72 },
            { "id": "F", "label": "F", "x": 94, "y": 25 }
          ],
          "edges": [
            { "from": "A", "to": "B", "label": "4" },
            { "from": "A", "to": "C", "label": "2" },
            { "from": "B", "to": "C", "label": "1" },
            { "from": "B", "to": "D", "label": "5" },
            { "from": "C", "to": "D", "label": "8" },
            { "from": "C", "to": "E", "label": "10" },
            { "from": "D", "to": "E", "label": "2" },
            { "from": "D", "to": "F", "label": "6" },
            { "from": "E", "to": "F", "label": "3" }
          ],
          "directed": false
        }
      },
      "takeaway": "Vertices are the things; edges are the relationships.",
      "bridge": "Edges can carry direction and cost, which changes the questions a graph can answer.",
      "sourceIds": ["princeton-graphs"]
    },
    {
      "id": "direction-and-weight",
      "milestoneId": "graph-language",
      "order": 2,
      "kind": "concept",
      "eyebrow": "Graph Basics · 2 of 8",
      "title": "Direction and weight change meaning",
      "learningObjective": "Distinguish directed, undirected, weighted, and unweighted graphs.",
      "coreFacts": [
        "An undirected edge {u, v} can be traversed both ways; a directed edge (u, v) points from u to v.",
        "Weights encode quantities such as cost, distance, or time.",
        "HarborNet is weighted and undirected."
      ],
      "estimatedSeconds": 60,
      "presentations": {
        "standard": {
          "hook": "The same pair of vertices can describe very different systems.",
          "body": [
            "An undirected edge A—B says A relates to B symmetrically. A directed edge A→B says the relation has an orientation; B→A is separate. A weighted edge adds a number such as cost or distance.",
            "HarborNet is undirected because a cable links both islands, and weighted because routes have different costs. BFS ignores these costs; MST algorithms use them."
          ]
        },
        "story": {
          "hook": "A ferry lane and a one-way shipping permit are not the same route.",
          "body": [
            "The Harbor Master draws cable links without arrows because signals travel both ways. She writes a cost beside each link, so the map is weighted and undirected.",
            "Analogy limit: weights need not be money, and directed graphs can still allow travel both ways when both directed edges are present."
          ]
        },
        "challenge": {
          "prompt": "A prerequisite relation says Course A must precede Course B. Directed or undirected? Weighted or unweighted?",
          "hint": "Can you reverse the relationship without changing its meaning? Is a numeric quantity required?",
          "answer": "Directed and usually unweighted: A→B has a different meaning from B→A, and the relation needs no number unless the problem adds one.",
          "body": [
            "Model semantics before selecting an algorithm. Many wrong interview solutions begin by silently treating directed edges as undirected."
          ]
        }
      },
      "takeaway": "Direction controls reachability; weights control optimization.",
      "bridge": "Once the model is fixed, choose how to store its edges.",
      "sourceIds": ["princeton-graphs", "princeton-mst"]
    },
    {
      "id": "graph-representations",
      "milestoneId": "graph-language",
      "order": 3,
      "kind": "concept",
      "eyebrow": "Graph Basics · 3 of 8",
      "title": "Choose a representation by operation",
      "learningObjective": "Compare adjacency lists, adjacency matrices, and edge lists.",
      "coreFacts": [
        "Adjacency lists use Θ(V + E) space and enumerate a vertex's neighbors efficiently.",
        "Adjacency matrices use Θ(V²) space and answer whether an edge exists in Θ(1).",
        "Edge lists are convenient when algorithms process or sort all edges."
      ],
      "estimatedSeconds": 80,